no,timestamp,teks,teks_processed,ground_truth_mean,ground_truth_scaled,sd_annotator,ground_truth_category,tokens,matched_words,ignored_words,unmatched_words
10940,2019-12-22T10:54:06.000Z,Ini tugas anggota saat reses ya?,ini tugas anggota saat reses ya ?,-0.6,-0.15,0.5477225575051662,negative,"['ini', 'tugas', 'anggota', 'saat', 'reses', 'ya', '?']","['tugas', 'anggota', 'reses']",['ya'],"['ini', 'saat', '?']"
10943,2019-12-22T06:57:41.000Z,Anggota DPR Aceh Salihin F PKB melaksanakan Reses II Tahun ke Daerah Pemilihan IV Kabupaten Aceh Tengah dan Bener Meriah resesdpra acehtengah benermeriah,anggota DPR aceh salihin f PKB melaksanakan reses II tahun ke daerah pemilihan IV kabupaten aceh tengah dan benar meriah resesdpra acehtengah benermeriah,0.0,0.0,0.0,neutral,"['anggota', 'DPR', 'aceh', 'salihin', 'f', 'PKB', 'melaksanakan', 'reses', 'II', 'tahun', 'ke', 'daerah', 'pemilihan', 'IV', 'kabupaten', 'aceh', 'tengah', 'dan', 'benar', 'meriah', 'resesdpra', 'acehtengah', 'benermeriah']","['anggota', 'DPR', 'aceh', 'PKB', 'melaksanakan', 'reses', 'II', 'tahun', 'daerah', 'pemilihan', 'IV', 'kabupaten', 'aceh', 'tengah', 'benar', 'meriah', 'resesdpra', 'acehtengah']",[],"['salihin', 'f', 'ke', 'dan', 'benermeriah']"
10964,2019-12-21T07:25:13.000Z,Tim Komisi III DPR RI Puji Layanan Keimigrasian di TPI Bandara Internasional Juanda SURABAYA Kunjungan kerja dalam rangka reses Komisi III DPR RI masa persidangan I Tahun berlanjut Usai melakukan rapat,tim komisi II DPR RI puji layanan keimigrasian di TETAPI bandara internasional juanda SURABAYA kunjungan kerja dalam rangka reses komisi II DPR RI masa persidangan i tahun berlanjut usai melakukan rapat,1.0,0.25,0.0,positive,"['tim', 'komisi', 'II', 'DPR', 'RI', 'puji', 'layanan', 'keimigrasian', 'di', 'TETAPI', 'bandara', 'internasional', 'juanda', 'SURABAYA', 'kunjungan', 'kerja', 'dalam', 'rangka', 'reses', 'komisi', 'II', 'DPR', 'RI', 'masa', 'persidangan', 'i', 'tahun', 'berlanjut', 'usai', 'melakukan', 'rapat']","['tim', 'komisi', 'II', 'DPR', 'RI', 'puji', 'layanan', 'internasional', 'SURABAYA', 'kunjungan', 'kerja', 'dalam', 'rangka', 'reses', 'komisi', 'II', 'DPR', 'RI', 'masa', 'persidangan', 'i', 'tahun', 'berlanjut', 'usai', 'rapat']",[],"['keimigrasian', 'di', 'TETAPI', 'bandara', 'juanda', 'melakukan']"
11000,2019-12-19T17:53:08.000Z,Dalam rangka Reses II Tahun ke Daerah Pemilihan VII Kabupaten Aceh Tamiang dan Kota Langsa Anggota DPR Aceh H Jauhari Amin SH MH melakukan penyerapan Aspirasi dari warga di Kota Langsa Secara resmi,dalam rangka reses II tahun ke daerah pemilihan VII kabupaten aceh tamiang dan kota langsa anggota DPR aceh h jauhari amin SH MAH melakukan penyerapan aspirasi dari warga di kota langsa secara resmi,0.0,0.0,0.0,neutral,"['dalam', 'rangka', 'reses', 'II', 'tahun', 'ke', 'daerah', 'pemilihan', 'VII', 'kabupaten', 'aceh', 'tamiang', 'dan', 'kota', 'langsa', 'anggota', 'DPR', 'aceh', 'h', 'jauhari', 'amin', 'SH', 'MAH', 'melakukan', 'penyerapan', 'aspirasi', 'dari', 'warga', 'di', 'kota', 'langsa', 'secara', 'resmi']","['dalam', 'rangka', 'reses', 'II', 'tahun', 'daerah', 'pemilihan', 'VII', 'kabupaten', 'aceh', 'kota', 'anggota', 'DPR', 'aceh', 'amin', 'penyerapan', 'aspirasi', 'warga', 'kota', 'resmi']",['dari'],"['ke', 'tamiang', 'dan', 'langsa', 'h', 'jauhari', 'SH', 'MAH', 'melakukan', 'di', 'langsa', 'secara']"
11049,2019-12-18T09:15:00.000Z,Pembatasan terhadap wartawan dan interupsi anggota DPR di rapat paripurna menunjukkan kecenderungan DPR yang saat ini tertutup antidialog bahkan mengarah pada otoriter Polhuk AdadiKompas,pembatasan terhadap wartawan dan interupsi anggota DPR di rapat paripurna menunjukkan kecenderungan DPR yang saat ini tertutup antidialog bahkan mengarah pada otoriter polhuk adadikompas,-3.0,-0.75,0.0,negative,"['pembatasan', 'terhadap', 'wartawan', 'dan', 'interupsi', 'anggota', 'DPR', 'di', 'rapat', 'paripurna', 'menunjukkan', 'kecenderungan', 'DPR', 'yang', 'saat', 'ini', 'tertutup', 'antidialog', 'bahkan', 'mengarah', 'pada', 'otoriter', 'polhuk', 'adadikompas']","['pembatasan', 'interupsi', 'anggota', 'DPR', 'rapat', 'paripurna', 'menunjukkan', 'DPR', 'tertutup', 'antidialog', 'mengarah', 'otoriter']","['yang', 'pada']","['terhadap', 'wartawan', 'dan', 'di', 'kecenderungan', 'saat', 'ini', 'bahkan', 'polhuk', 'adadikompas']"
11066,2019-12-17T23:17:20.000Z,Tertarik pada point huruf d dan i Pemantauan dana aspirasi DPR dan Open Parliament Indonesia OPI Rapat Paripurna DPR RI Ke Masa Persidangan I Tahun Sidang dengan agenda Laporan Badan,tertarik pada point huruf di dan i pemantauan dana aspirasi DPR dan open parliament indonesia OPI rapat paripurna DPR RI ke masa persidangan i tahun sidang dengan agenda laporan badan,0.8,0.2,0.447213595499958,positive,"['tertarik', 'pada', 'point', 'huruf', 'di', 'dan', 'i', 'pemantauan', 'dana', 'aspirasi', 'DPR', 'dan', 'open', 'parliament', 'indonesia', 'OPI', 'rapat', 'paripurna', 'DPR', 'RI', 'ke', 'masa', 'persidangan', 'i', 'tahun', 'sidang', 'dengan', 'agenda', 'laporan', 'badan']","['tertarik', 'i', 'dana', 'aspirasi', 'DPR', 'open', 'parliament', 'indonesia', 'rapat', 'paripurna', 'DPR', 'RI', 'masa', 'persidangan', 'i', 'tahun', 'sidang', 'agenda', 'laporan', 'badan']",['pada'],"['point', 'huruf', 'di', 'dan', 'pemantauan', 'dan', 'OPI', 'ke', 'dengan']"
11067,2019-12-17T20:10:00.000Z,Sejumlah Anggota DPR Pesimistis soal Target RUU Prolegnas,sejumlah anggota DPR pesimistis soal target RUU prolegnas,-1.0,-0.25,0.0,negative,"['sejumlah', 'anggota', 'DPR', 'pesimistis', 'soal', 'target', 'RUU', 'prolegnas']","['sejumlah', 'anggota', 'DPR', 'pesimistis', 'soal', 'target', 'RUU', 'prolegnas']",[],[]
11068,2019-12-17T20:03:48.000Z,Foto Rapat paripurna DPR RI mengesahkan program legislasi nasional prolegnas untuk DPR juga sepakat mengesahkan RUU masuk prolegnas prioritas Begini momennya RUU,foto rapat paripurna DPR RI mengesahkan program legislasi nasional prolegnas untuk DPR juga sepakat mengesahkan RUU masuk prolegnas prioritas begini momennya RUU,0.6,0.15,0.5477225575051662,positive,"['foto', 'rapat', 'paripurna', 'DPR', 'RI', 'mengesahkan', 'program', 'legislasi', 'nasional', 'prolegnas', 'untuk', 'DPR', 'juga', 'sepakat', 'mengesahkan', 'RUU', 'masuk', 'prolegnas', 'prioritas', 'begini', 'momennya', 'RUU']","['foto', 'rapat', 'paripurna', 'DPR', 'RI', 'mengesahkan', 'program', 'legislasi', 'nasional', 'prolegnas', 'DPR', 'sepakat', 'mengesahkan', 'RUU', 'masuk', 'prolegnas', 'prioritas', 'begini', 'RUU']",[],"['untuk', 'juga', 'momennya']"
11069,2019-12-17T17:55:22.000Z,DPR RI Minta TV Dukung RUU Penyiaran,DPR RI meminta TV dukung RUU penyiaran,0.0,0.0,0.0,neutral,"['DPR', 'RI', 'meminta', 'TV', 'dukung', 'RUU', 'penyiaran']","['DPR', 'RI', 'meminta', 'dukung', 'RUU', 'penyiaran']",[],['TV']
11082,2019-12-17T08:52:16.000Z,DPR Sepakati RUU Prolegnas dan Prolegnas Prioritas,DPR sepakati RUU prolegnas dan prolegnas prioritas,0.4,0.1,0.5477225575051662,positive,"['DPR', 'sepakati', 'RUU', 'prolegnas', 'dan', 'prolegnas', 'prioritas']","['DPR', 'RUU', 'prolegnas', 'prolegnas', 'prioritas']",[],"['sepakati', 'dan']"
11114,2019-12-16T14:20:44.000Z,Pak doktor anda berkesempatan untuk menjawab bantahan bu susi Sebagai anggota dpr seharusnya anda kritis pada kebijakan mentri bukan malah dukung kebijakan ygvkontroversi,pak doktor anda berkesempatan untuk menjawab bantahan bu susi sebagai anggota dpr seharusnya anda kritis pada kebijakan mentri bukan malah dukung kebijakan ygvkontroversi,-2.0,-0.5,0.0,negative,"['pak', 'doktor', 'anda', 'berkesempatan', 'untuk', 'menjawab', 'bantahan', 'bu', 'susi', 'sebagai', 'anggota', 'dpr', 'seharusnya', 'anda', 'kritis', 'pada', 'kebijakan', 'mentri', 'bukan', 'malah', 'dukung', 'kebijakan', 'ygvkontroversi']","['pak', 'bantahan', 'sebagai', 'anggota', 'dpr', 'kritis', 'kebijakan', 'mentri', 'dukung', 'kebijakan']","['anda', 'anda', 'pada', 'bukan']","['doktor', 'berkesempatan', 'untuk', 'menjawab', 'bu', 'susi', 'seharusnya', 'malah', 'ygvkontroversi']"
11145,2019-12-13T18:31:54.000Z,Menteri tidak mau menjadi pihak yang sotoy terus merumuskan kebijakan sendiri sebagai seolah sebagai father know every things Tidak Mas punya rekam jejak panjang sebagai tahun penuh memimpin komisi IV DPR RI sebagai pendengar yang baik,menteri tidak mau menjadi pihak yang sok tau terus merumuskan kebijakan sendiri sebagai seolah sebagai father know every things tidak mas punya rekam jejak panjang sebagai tahun penuh memimpin komisi IV DPR RI sebagai pendengar yang baik,0.6,0.15,0.8944271909999161,positive,"['menteri', 'tidak', 'mau', 'menjadi', 'pihak', 'yang', 'sok', 'tau', 'terus', 'merumuskan', 'kebijakan', 'sendiri', 'sebagai', 'seolah', 'sebagai', 'father', 'know', 'every', 'things', 'tidak', 'mas', 'punya', 'rekam', 'jejak', 'panjang', 'sebagai', 'tahun', 'penuh', 'memimpin', 'komisi', 'IV', 'DPR', 'RI', 'sebagai', 'pendengar', 'yang', 'baik']","['menteri', 'mau', 'pihak', 'tau', 'merumuskan', 'kebijakan', 'sendiri', 'sebagai', 'sebagai', 'punya', 'rekam', 'panjang', 'sebagai', 'tahun', 'memimpin', 'komisi', 'IV', 'DPR', 'RI', 'sebagai', 'baik']","['tidak', 'yang', 'tidak', 'yang']","['menjadi', 'sok', 'terus', 'seolah', 'father', 'know', 'every', 'things', 'mas', 'jejak', 'penuh', 'pendengar']"
11195,2020-12-28T11:02:37.000Z,Oktober menjadi masa puncak kontroversi pengusunan RUU Cipta Kerja Di tengah gelombang demonstrasi Dewan Perwakilan Rakyat mengesahkan undang undang sapu jagat yang dinilai mengancam buruh dan lingkungan hidup ini MajalahTempo,oktober menjadi masa puncak kontroversi pengusunan RUU cipta kerja di tengah gelombang demonstrasi dewan perwakilan rakyat mengesahkan undang undang sapu jagat yang dinilai mengancam buruh dan lingkungan hidup ini majalahtempo,-2.2,-0.55,0.4472135954999579,negative,"['oktober', 'menjadi', 'masa', 'puncak', 'kontroversi', 'pengusunan', 'RUU', 'cipta', 'kerja', 'di', 'tengah', 'gelombang', 'demonstrasi', 'dewan', 'perwakilan', 'rakyat', 'mengesahkan', 'undang', 'undang', 'sapu', 'jagat', 'yang', 'dinilai', 'mengancam', 'buruh', 'dan', 'lingkungan', 'hidup', 'ini', 'majalahtempo']","['oktober', 'masa', 'puncak', 'kontroversi', 'RUU', 'cipta', 'kerja', 'tengah', 'demonstrasi', 'dewan', 'perwakilan', 'rakyat', 'mengesahkan', 'undang', 'undang', 'sapu', 'dinilai', 'mengancam', 'buruh', 'lingkungan', 'hidup']",['yang'],"['menjadi', 'pengusunan', 'di', 'gelombang', 'jagat', 'dan', 'ini', 'majalahtempo']"
11201,2020-12-28T07:24:23.000Z,Sebab Tidak ada hukum bagi seorang wakil rakyat dalam menentukan kebijakan rumusan uu yang sudah disah Arinya manusia harus mencari jalan solusi Sesuatu yang salah harus diperjuangkan utk benarkan Bukan membentuk gurita gurita baru,sebab tidak ada hukum bagi seorang wakil rakyat dalam menentukan kebijakan rumusan uu yang sudah disah arinya manusia harus mencari jalan solusi sesuatu yang salah harus diperjuangkan untuk benarkan bukan membentuk gurita gurita baru,-0.4,-0.1,0.5477225575051662,negative,"['sebab', 'tidak', 'ada', 'hukum', 'bagi', 'seorang', 'wakil', 'rakyat', 'dalam', 'menentukan', 'kebijakan', 'rumusan', 'uu', 'yang', 'sudah', 'disah', 'arinya', 'manusia', 'harus', 'mencari', 'jalan', 'solusi', 'sesuatu', 'yang', 'salah', 'harus', 'diperjuangkan', 'untuk', 'benarkan', 'bukan', 'membentuk', 'gurita', 'gurita', 'baru']","['sebab', 'ada', 'hukum', 'bagi', 'wakil', 'rakyat', 'dalam', 'menentukan', 'kebijakan', 'rumusan', 'uu', 'disah', 'manusia', 'mencari', 'solusi', 'salah', 'diperjuangkan', 'membentuk']","['tidak', 'yang', 'sudah', 'harus', 'yang', 'harus', 'bukan']","['seorang', 'arinya', 'jalan', 'sesuatu', 'untuk', 'benarkan', 'gurita', 'gurita', 'baru']"
11265,2020-12-21T05:21:56.000Z,Baleg DPR tidak menemukan halangan saat mengusulkan RUU PKS masuk dalam pembahasan Program Legislasi Nasional Prolegnas Prioritas Komitmen itu diharapkan tidak berubah hingga pengesahan di rapat paripurna DPR ruuPKS FRAKSINASDEM,baleg DPR tidak menemukan halangan saat mengusulkan RUU PKS masuk dalam pembahasan program legislasi nasional prolegnas prioritas komitmen itu diharapkan tidak berubah hingga pengesahan di rapat paripurna DPR ruupks FRAKSINASDEM,0.8,0.2,0.447213595499958,positive,"['baleg', 'DPR', 'tidak', 'menemukan', 'halangan', 'saat', 'mengusulkan', 'RUU', 'PKS', 'masuk', 'dalam', 'pembahasan', 'program', 'legislasi', 'nasional', 'prolegnas', 'prioritas', 'komitmen', 'itu', 'diharapkan', 'tidak', 'berubah', 'hingga', 'pengesahan', 'di', 'rapat', 'paripurna', 'DPR', 'ruupks', 'FRAKSINASDEM']","['baleg', 'DPR', 'menemukan', 'halangan', 'mengusulkan', 'RUU', 'PKS', 'masuk', 'dalam', 'pembahasan', 'program', 'legislasi', 'nasional', 'prolegnas', 'prioritas', 'komitmen', 'diharapkan', 'berubah', 'pengesahan', 'rapat', 'paripurna', 'DPR', 'ruupks', 'FRAKSINASDEM']","['tidak', 'itu', 'tidak']","['saat', 'hingga', 'di']"
11326,2020-12-16T06:24:29.000Z,Anggota Komisi X DPR RI Yoyok Sukawi mendesak adanya angka pasti di dalam APBN untuk dunia olahraga Menurut Yoyok Sukawi yang termasuk anggota Panja RUU SKN sudah saatnya dunia olahraga lebih diperhatikan dgn memberi porsi anggaran yang lebih ideal,anggota komisi kali DPR RI yoyok sukawi mendesak adanya angka pasti di dalam APBN untuk dunia olahraga menurut yoyok sukawi yang termasuk anggota panja RUU SKN sudah saatnya dunia olahraga lebih diperhatikan dengan memberi porsi anggaran yang lebih ideal,1.0,0.25,0.0,positive,"['anggota', 'komisi', 'kali', 'DPR', 'RI', 'yoyok', 'sukawi', 'mendesak', 'adanya', 'angka', 'pasti', 'di', 'dalam', 'APBN', 'untuk', 'dunia', 'olahraga', 'menurut', 'yoyok', 'sukawi', 'yang', 'termasuk', 'anggota', 'panja', 'RUU', 'SKN', 'sudah', 'saatnya', 'dunia', 'olahraga', 'lebih', 'diperhatikan', 'dengan', 'memberi', 'porsi', 'anggaran', 'yang', 'lebih', 'ideal']","['anggota', 'komisi', 'DPR', 'RI', 'mendesak', 'pasti', 'dalam', 'APBN', 'dunia', 'menurut', 'termasuk', 'anggota', 'panja', 'RUU', 'dunia', 'lebih', 'memberi', 'porsi', 'anggaran', 'lebih', 'ideal']","['yang', 'sudah', 'yang']","['kali', 'yoyok', 'sukawi', 'adanya', 'angka', 'di', 'untuk', 'olahraga', 'yoyok', 'sukawi', 'SKN', 'saatnya', 'olahraga', 'diperhatikan', 'dengan']"
11336,2020-12-15T11:35:37.000Z,Upaya Pemerintah dan DPR RI memulihkan perekonomian nasional melalui pengesahan UU Cipta Kerja mendapat sorotan dari kalangan buruh mahasiswa dan kelompok kepentingan Sejumlah pasal dapat meningkatkan kesejahteraan buruh dan masyarakat secara umum,upaya pemerintah dan DPR RI memulihkan perekonomian nasional melalui pengesahan UU cipta kerja mendapat sorotan dari kalangan buruh mahasiswa dan kelompok kepentingan sejumlah pasal dapat meningkatkan kesejahteraan buruh dan masyarakat secara umum,0.8,0.2,0.447213595499958,positive,"['upaya', 'pemerintah', 'dan', 'DPR', 'RI', 'memulihkan', 'perekonomian', 'nasional', 'melalui', 'pengesahan', 'UU', 'cipta', 'kerja', 'mendapat', 'sorotan', 'dari', 'kalangan', 'buruh', 'mahasiswa', 'dan', 'kelompok', 'kepentingan', 'sejumlah', 'pasal', 'dapat', 'meningkatkan', 'kesejahteraan', 'buruh', 'dan', 'masyarakat', 'secara', 'umum']","['upaya', 'pemerintah', 'DPR', 'RI', 'memulihkan', 'perekonomian', 'nasional', 'melalui', 'pengesahan', 'UU', 'cipta', 'kerja', 'mendapat', 'sorotan', 'buruh', 'mahasiswa', 'kelompok', 'kepentingan', 'sejumlah', 'pasal', 'dapat', 'meningkatkan', 'kesejahteraan', 'buruh', 'masyarakat', 'umum']",['dari'],"['dan', 'kalangan', 'dan', 'dan', 'secara']"
11408,2020-12-10T01:06:50.000Z,Gini yah kerjaan wakil rakyat pas pemilihan minta suara rakyat pas kepilih lgsg tuli gk mendengar aspirasi rakyat nah skrg dah pda pinter rakyat gk penting jg milih krn bakal gitu aja pesta politik jalan terus d tengah wabah,begini ya pekerjaan wakil rakyat pas pemilihan meminta suara rakyat pas kepilih langsung tuli tidak mendengar aspirasi rakyat nah sekarang deh pada pintar rakyat tidak penting juga memilih karena bakal begitu saja pesta politik jalan terus di tengah wabah,-3.2,-0.8,0.8366600265340756,negative,"['begini', 'ya', 'pekerjaan', 'wakil', 'rakyat', 'pas', 'pemilihan', 'meminta', 'suara', 'rakyat', 'pas', 'kepilih', 'langsung', 'tuli', 'tidak', 'mendengar', 'aspirasi', 'rakyat', 'nah', 'sekarang', 'deh', 'pada', 'pintar', 'rakyat', 'tidak', 'penting', 'juga', 'memilih', 'karena', 'bakal', 'begitu', 'saja', 'pesta', 'politik', 'jalan', 'terus', 'di', 'tengah', 'wabah']","['begini', 'pekerjaan', 'wakil', 'rakyat', 'pas', 'pemilihan', 'meminta', 'suara', 'rakyat', 'pas', 'langsung', 'tuli', 'aspirasi', 'rakyat', 'rakyat', 'penting', 'saja', 'pesta', 'politik', 'tengah', 'wabah']","['ya', 'tidak', 'pada', 'tidak', 'karena']","['kepilih', 'mendengar', 'nah', 'sekarang', 'deh', 'pintar', 'juga', 'memilih', 'bakal', 'begitu', 'jalan', 'terus', 'di']"
11440,2020-12-07T16:14:23.000Z,RUU Jalan Disetujui jadi Usul Inisiatif DPR RI,RUU jalan disetujui jadi usul inisiatif DPR RI,0.8,0.2,0.447213595499958,positive,"['RUU', 'jalan', 'disetujui', 'jadi', 'usul', 'inisiatif', 'DPR', 'RI']","['RUU', 'disetujui', 'jadi', 'usul', 'inisiatif', 'DPR', 'RI']",[],['jalan']
11459,2020-12-07T01:20:54.000Z,Terima kasih sdh mau menjelaskan pd pak BTP dan pd publik Jangan kecewakan dan khianati masyarakat ya mba jadilah wakil rakyat yg benar menyuarakan aspirasi rakyat dan selalu menggunakan hati nurani hikmat marifat Tuhan dan akal waras dlm bekerja,terima kasih sudah mau menjelaskan pada pak BTP dan pada publik jangan kecewakan dan khianati masyarakat ya mbak jadilah wakil rakyat yang benar menyuarakan aspirasi rakyat dan selalu menggunakan hati nurani hikmat marifat tuhan dan akal waras dalam bekerja,1.0,0.25,0.0,positive,"['terima', 'kasih', 'sudah', 'mau', 'menjelaskan', 'pada', 'pak', 'BTP', 'dan', 'pada', 'publik', 'jangan', 'kecewakan', 'dan', 'khianati', 'masyarakat', 'ya', 'mbak', 'jadilah', 'wakil', 'rakyat', 'yang', 'benar', 'menyuarakan', 'aspirasi', 'rakyat', 'dan', 'selalu', 'menggunakan', 'hati', 'nurani', 'hikmat', 'marifat', 'tuhan', 'dan', 'akal', 'waras', 'dalam', 'bekerja']","['terima', 'kasih', 'mau', 'menjelaskan', 'pak', 'publik', 'kecewakan', 'khianati', 'masyarakat', 'wakil', 'rakyat', 'benar', 'menyuarakan', 'aspirasi', 'rakyat', 'menggunakan', 'hati', 'nurani', 'hikmat', 'tuhan', 'waras', 'dalam']","['sudah', 'pada', 'pada', 'jangan', 'ya', 'yang']","['BTP', 'dan', 'dan', 'mbak', 'jadilah', 'dan', 'selalu', 'marifat', 'dan', 'akal', 'bekerja']"
11510,2020-12-02T10:09:35.000Z,Anggota Batalyon C Pelopor Satuan Brimob Polda Metro Jaya Melaksanakan Kegiatan Pengamanan Unjuk Rasa Dari PPMI Persaudaraan Pekerja Muslim Indonesia Jumlah orang Tuntutan Batalkan RUU Omnibuslaw Di Gedung MPR DPR RI Jakarta Pusat,anggota batalyon sih pelopor satuan brimob polda metro jaya melaksanakan kegiatan pengamanan unjuk rasa dari PPMI persaudaraan pekerja muslim indonesia jumlah orang tuntutan batalkan RUU omnibuslaw di gedung MPR DPR RI jakarta pusat,-0.8,-0.2,0.447213595499958,negative,"['anggota', 'batalyon', 'sih', 'pelopor', 'satuan', 'brimob', 'polda', 'metro', 'jaya', 'melaksanakan', 'kegiatan', 'pengamanan', 'unjuk', 'rasa', 'dari', 'PPMI', 'persaudaraan', 'pekerja', 'muslim', 'indonesia', 'jumlah', 'orang', 'tuntutan', 'batalkan', 'RUU', 'omnibuslaw', 'di', 'gedung', 'MPR', 'DPR', 'RI', 'jakarta', 'pusat']","['anggota', 'jaya', 'melaksanakan', 'kegiatan', 'unjuk', 'rasa', 'persaudaraan', 'pekerja', 'muslim', 'indonesia', 'orang', 'tuntutan', 'batalkan', 'RUU', 'omnibuslaw', 'gedung', 'MPR', 'DPR', 'RI', 'jakarta', 'pusat']",['dari'],"['batalyon', 'sih', 'pelopor', 'satuan', 'brimob', 'polda', 'metro', 'pengamanan', 'PPMI', 'jumlah', 'di']"
11526,2020-12-01T05:22:35.000Z,surat presiden naskah RUU Cipta Kerja serta naskah akademik yg menyertainya kepada Ketua dan Wakil Ketua tanggal Februari KumhamPasti OmnibusLawTaatProsedural Kumham,surat presiden naskah RUU cipta kerja serta naskah akademik yang menyertainya kepada ketua dan wakil ketua tanggal februari kumhampasti omnibuslawtaatprosedural kumham,0.0,0.0,0.0,neutral,"['surat', 'presiden', 'naskah', 'RUU', 'cipta', 'kerja', 'serta', 'naskah', 'akademik', 'yang', 'menyertainya', 'kepada', 'ketua', 'dan', 'wakil', 'ketua', 'tanggal', 'februari', 'kumhampasti', 'omnibuslawtaatprosedural', 'kumham']","['surat', 'presiden', 'naskah', 'RUU', 'cipta', 'kerja', 'serta', 'naskah', 'akademik', 'kepada', 'ketua', 'wakil', 'ketua', 'tanggal', 'februari', 'kumhampasti', 'omnibuslawtaatprosedural']",['yang'],"['menyertainya', 'dan', 'kumham']"
11533,2020-11-30T13:36:23.000Z,Webinar ini dilatarbelakangi lantaran kekhawatiran DPR RI atas perkembangan situasi Palestina khususnya dampak dari kebijakan ceroboh Donald Trump yang sangat merugikan masa depan Palestina diplomasiparlemen,webinar ini dilatarbelakangi lantaran kekhawatiran DPR RI atas perkembangan situasi palestina khususnya dampak dari kebijakan ceroboh donald trump yang sangat merugikan masa depan palestina diplomasiparlemen,0.4,0.1,0.5477225575051662,positive,"['webinar', 'ini', 'dilatarbelakangi', 'lantaran', 'kekhawatiran', 'DPR', 'RI', 'atas', 'perkembangan', 'situasi', 'palestina', 'khususnya', 'dampak', 'dari', 'kebijakan', 'ceroboh', 'donald', 'trump', 'yang', 'sangat', 'merugikan', 'masa', 'depan', 'palestina', 'diplomasiparlemen']","['lantaran', 'kekhawatiran', 'DPR', 'RI', 'atas', 'perkembangan', 'palestina', 'dampak', 'kebijakan', 'ceroboh', 'merugikan', 'masa', 'palestina']","['dari', 'yang', 'sangat']","['webinar', 'ini', 'dilatarbelakangi', 'situasi', 'khususnya', 'donald', 'trump', 'depan', 'diplomasiparlemen']"
11554,2020-11-28T04:20:20.000Z,Pemerintah bersama Dewan Perwakilan Rakyat DPR RI menginisiasi Rancangan Undang undang RUU Omnibus Law Sektor Keuangan,pemerintah bersama dewan perwakilan rakyat DPR RI menginisiasi rancangan undang undang RUU omnibus law sektor keuangan,0.8,0.2,0.447213595499958,positive,"['pemerintah', 'bersama', 'dewan', 'perwakilan', 'rakyat', 'DPR', 'RI', 'menginisiasi', 'rancangan', 'undang', 'undang', 'RUU', 'omnibus', 'law', 'sektor', 'keuangan']","['pemerintah', 'bersama', 'dewan', 'perwakilan', 'rakyat', 'DPR', 'RI', 'menginisiasi', 'rancangan', 'undang', 'undang', 'RUU', 'omnibus', 'sektor', 'keuangan']",[],['law']
11555,2020-11-28T02:26:36.000Z,Bagaimana Penjelasan lengkap terkait aturan Medsos untuk pengguna media sosial usia di bawah tahun di Rancangan Undang Undang Perlindungan Data Pribadi RUU PDP ? Simak saat ini pembahasannya bersama Anggota Komisi DPR RI Muhammad Farhan,bagaimana penjelasan lengkap terkait aturan medsos untuk pengguna media sosial usia di bawah tahun di rancangan undang undang perlindungan data pribadi RUU PDP ? simak saat ini pembahasannya bersama anggota komisi DPR RI muhammad farhan,0.8,0.2,0.447213595499958,positive,"['bagaimana', 'penjelasan', 'lengkap', 'terkait', 'aturan', 'medsos', 'untuk', 'pengguna', 'media', 'sosial', 'usia', 'di', 'bawah', 'tahun', 'di', 'rancangan', 'undang', 'undang', 'perlindungan', 'data', 'pribadi', 'RUU', 'PDP', '?', 'simak', 'saat', 'ini', 'pembahasannya', 'bersama', 'anggota', 'komisi', 'DPR', 'RI', 'muhammad', 'farhan']","['penjelasan', 'lengkap', 'terkait', 'aturan', 'medsos', 'pengguna', 'media', 'sosial', 'tahun', 'rancangan', 'undang', 'undang', 'perlindungan', 'data', 'RUU', 'simak', 'pembahasannya', 'bersama', 'anggota', 'komisi', 'DPR', 'RI']",[],"['bagaimana', 'untuk', 'usia', 'di', 'bawah', 'di', 'pribadi', 'PDP', '?', 'saat', 'ini', 'muhammad', 'farhan']"
11625,2020-11-25T17:01:09.000Z,DPR RI Gila RUU HIP Masih Diagendakan,DPR RI gila RUU HIP masih diagendakan,-3.0,-0.75,0.0,negative,"['DPR', 'RI', 'gila', 'RUU', 'HIP', 'masih', 'diagendakan']","['DPR', 'RI', 'gila', 'RUU', 'masih', 'diagendakan']",[],['HIP']
11646,2020-11-25T05:31:26.000Z,Apa hak MUI mempermasalahkan tentang hal itu kebijakan ada di presiden tentu atas persetujuan anggot DPR RI,apa hak MUI mempermasalahkan tentang hal itu kebijakan ada di presiden tentu atas persetujuan anggot DPR RI,-0.2,-0.05,0.447213595499958,negative,"['apa', 'hak', 'MUI', 'mempermasalahkan', 'tentang', 'hal', 'itu', 'kebijakan', 'ada', 'di', 'presiden', 'tentu', 'atas', 'persetujuan', 'anggot', 'DPR', 'RI']","['hak', 'tentang', 'kebijakan', 'ada', 'presiden', 'tentu', 'atas', 'persetujuan', 'DPR', 'RI']","['apa', 'itu']","['MUI', 'mempermasalahkan', 'hal', 'di', 'anggot']"
11654,2021-12-30T16:10:11.000Z,Gak penting banget bahas itu?? Itu RUU perampasan asset koruptor kenapa gak disetujui !!! Ngapain lah kau Bang?? Sesekali Berguna lah kau sebagai orang penting di NKRI ini??,tidak penting banget bahas itu ? ? itu RUU perampasan asset koruptor kenapa tidak disetujui ! ! mengapai lah kau bang ? ? sesekali berguna lah kau sebagai orang penting di NKRI ini ? ?,-2.8,-0.7,0.4472135954999578,negative,"['tidak', 'penting', 'banget', 'bahas', 'itu', '?', '?', 'itu', 'RUU', 'perampasan', 'asset', 'koruptor', 'kenapa', 'tidak', 'disetujui', '!', '!', 'mengapai', 'lah', 'kau', 'bang', '?', '?', 'sesekali', 'berguna', 'lah', 'kau', 'sebagai', 'orang', 'penting', 'di', 'NKRI', 'ini', '?', '?']","['penting', 'banget', 'bahas', 'RUU', 'perampasan', 'koruptor', 'disetujui', 'bang', 'berguna', 'sebagai', 'orang', 'penting', 'NKRI']","['tidak', 'itu', 'itu', 'tidak']","['?', '?', 'asset', 'kenapa', '!', '!', 'mengapai', 'lah', 'kau', '?', '?', 'sesekali', 'lah', 'kau', 'di', 'ini', '?', '?']"
11663,2021-12-30T11:32:12.000Z,Takut hidupnya melarat pantesan nolak RUU,takut hidupnya melarat pantesan nolak RUU,-2.8,-0.7,0.4472135954999578,negative,"['takut', 'hidupnya', 'melarat', 'pantesan', 'nolak', 'RUU']","['takut', 'melarat', 'pantesan', 'nolak', 'RUU']",[],['hidupnya']
