no,timestamp,teks,teks_processed,ground_truth_mean,ground_truth_scaled,sd_annotator,ground_truth_category,tokens,matched_words,ignored_words,unmatched_words
50,2016-12-24T13:54:06.000Z,Komisi IX Ketua Komisi IX DPR RI merekomendasikan kpd pem agar tinjau ulang kebijakan bebas visa,komisi IX ketua komisi IX DPR RI merekomendasikan kepada pem agar tinjau ulang kebijakan bebas visa,0.8,0.2,0.447213595499958,positive,"['komisi', 'IX', 'ketua', 'komisi', 'IX', 'DPR', 'RI', 'merekomendasikan', 'kepada', 'pem', 'agar', 'tinjau', 'ulang', 'kebijakan', 'bebas', 'visa']","['komisi', 'IX', 'ketua', 'komisi', 'IX', 'DPR', 'RI', 'merekomendasikan', 'kepada', 'agar', 'tinjau', 'ulang', 'kebijakan', 'bebas', 'visa']",[],['pem']
84,2016-12-21T08:47:51.000Z,Dapilku Rumahku Reses dan silaturahim bersama anggota DPR RI PKBMembelaRakyat,dapilku rumahku reses dan silaturahim bersama anggota DPR RI pkbmembelarakyat,0.8,0.2,0.447213595499958,positive,"['dapilku', 'rumahku', 'reses', 'dan', 'silaturahim', 'bersama', 'anggota', 'DPR', 'RI', 'pkbmembelarakyat']","['rumahku', 'reses', 'silaturahim', 'bersama', 'anggota', 'DPR', 'RI', 'pkbmembelarakyat']",[],"['dapilku', 'dan']"
89,2016-12-20T18:32:07.000Z,mengharukan wakil rakyat trlalu banyak waktunya utk update disosmed hampir ga ada waktu utk update aspirasi rakyat yg diwakilinya,mengharukan wakil rakyat terlalu banyak waktunya untuk update disosmed hampir tidak ada waktu untuk update aspirasi rakyat yang diwakilinya,-2.8,-0.7,0.4472135954999578,negative,"['mengharukan', 'wakil', 'rakyat', 'terlalu', 'banyak', 'waktunya', 'untuk', 'update', 'disosmed', 'hampir', 'tidak', 'ada', 'waktu', 'untuk', 'update', 'aspirasi', 'rakyat', 'yang', 'diwakilinya']","['mengharukan', 'wakil', 'rakyat', 'terlalu', 'banyak', 'update', 'ada', 'waktu', 'update', 'aspirasi', 'rakyat']","['tidak', 'yang']","['waktunya', 'untuk', 'disosmed', 'hampir', 'untuk', 'diwakilinya']"
101,2016-12-20T04:39:14.000Z,Ketua dan Para Wakil Ketua DPR RI PERLUNYA RUU PELAPORAN KEUANGAN UNTUK DUNIA BISNIS USAHA DI via,ketua dan para wakil ketua DPR RI PERLUNYA RUU PELAPORAN KEUANGAN UNTUK DUNIA BISNIS USAHA DI via,0.8,0.2,0.447213595499958,positive,"['ketua', 'dan', 'para', 'wakil', 'ketua', 'DPR', 'RI', 'PERLUNYA', 'RUU', 'PELAPORAN', 'KEUANGAN', 'UNTUK', 'DUNIA', 'BISNIS', 'USAHA', 'DI', 'via']","['ketua', 'para', 'wakil', 'ketua', 'DPR', 'RI', 'RUU', 'PELAPORAN', 'KEUANGAN', 'DUNIA', 'BISNIS', 'USAHA']",[],"['dan', 'PERLUNYA', 'UNTUK', 'DI', 'via']"
121,2016-12-18T04:07:09.000Z,Viva Anggota DPR Minta TNI AU Investigasi Kecelakaan Hercules Mereka siap jika harus membuat kebijakan NewsToday,viva anggota DPR meminta TNI AU investigasi kecelakaan hercules mereka siap jika harus membuat kebijakan newstoday,0.6,0.15,0.5477225575051662,positive,"['viva', 'anggota', 'DPR', 'meminta', 'TNI', 'AU', 'investigasi', 'kecelakaan', 'hercules', 'mereka', 'siap', 'jika', 'harus', 'membuat', 'kebijakan', 'newstoday']","['viva', 'anggota', 'DPR', 'meminta', 'TNI', 'AU', 'investigasi', 'kecelakaan', 'mereka', 'siap', 'membuat', 'kebijakan']",['harus'],"['hercules', 'jika', 'newstoday']"
135,2016-12-16T16:43:12.000Z,Komisi IX Pelajari Program Harga Pas Dan Anak Tokcer Komisi IX DPR RI dalam Masa Reses Persidangan II Tahun Sidang,komisi IX pelajari program harga pas dan anak tokcer komisi IX DPR RI dalam masa reses persidangan II tahun sidang,0.0,0.0,0.0,neutral,"['komisi', 'IX', 'pelajari', 'program', 'harga', 'pas', 'dan', 'anak', 'tokcer', 'komisi', 'IX', 'DPR', 'RI', 'dalam', 'masa', 'reses', 'persidangan', 'II', 'tahun', 'sidang']","['komisi', 'IX', 'program', 'harga', 'pas', 'anak', 'tokcer', 'komisi', 'IX', 'DPR', 'RI', 'dalam', 'masa', 'reses', 'persidangan', 'II', 'tahun', 'sidang']",[],"['pelajari', 'dan']"
150,2016-12-16T03:02:32.000Z,Dwi Murdaningsih RUU Jasa Konstruksi Resmi Disahkan Menjadi UU,dwi murdaningsih RUU jasa konstruksi resmi disahkan menjadi UU,0.8,0.2,0.447213595499958,positive,"['dwi', 'murdaningsih', 'RUU', 'jasa', 'konstruksi', 'resmi', 'disahkan', 'menjadi', 'UU']","['RUU', 'jasa', 'konstruksi', 'resmi', 'disahkan', 'UU']",[],"['dwi', 'murdaningsih', 'menjadi']"
168,2016-12-15T09:59:13.000Z,Paripurna DPR Setujui RUU Pertembakauan untuk Dibahas ROL,paripurna DPR setujui RUU pertembakauan untuk dibahas ROL,0.2,0.05,0.447213595499958,positive,"['paripurna', 'DPR', 'setujui', 'RUU', 'pertembakauan', 'untuk', 'dibahas', 'ROL']","['paripurna', 'DPR', 'setujui', 'RUU', 'pertembakauan', 'dibahas']",[],"['untuk', 'ROL']"
359,2016-11-30T04:03:17.000Z,Jakarta Proses pergantian Ketua DPR RI yang diusulkan oleh Partai Golkar sampai puncaknya hari ini Sore ini DPR,jakarta proses pergantian ketua DPR RI yang diusulkan oleh partai golkar sampai puncaknya hari ini sore ini DPR,0.0,0.0,0.0,neutral,"['jakarta', 'proses', 'pergantian', 'ketua', 'DPR', 'RI', 'yang', 'diusulkan', 'oleh', 'partai', 'golkar', 'sampai', 'puncaknya', 'hari', 'ini', 'sore', 'ini', 'DPR']","['jakarta', 'proses', 'ketua', 'DPR', 'RI', 'partai', 'golkar', 'sampai', 'hari', 'DPR']","['yang', 'oleh']","['pergantian', 'diusulkan', 'puncaknya', 'ini', 'sore', 'ini']"
360,2016-11-30T03:42:13.000Z,RUU Ketentuan Umum Perpajakan Masih Dibahas DPR,RUU ketentuan umum perpajakan masih dibahas DPR,0.0,0.0,0.0,neutral,"['RUU', 'ketentuan', 'umum', 'perpajakan', 'masih', 'dibahas', 'DPR']","['RUU', 'ketentuan', 'umum', 'perpajakan', 'masih', 'dibahas', 'DPR']",[],[]
363,2016-11-30T02:17:29.000Z,Agenda DPR Rabu Pukul WIB Rapat Paripurna DPR RI agendaDPR,agenda DPR rabu pukul WIB rapat paripurna DPR RI agendadpr,0.0,0.0,0.0,neutral,"['agenda', 'DPR', 'rabu', 'pukul', 'WIB', 'rapat', 'paripurna', 'DPR', 'RI', 'agendadpr']","['agenda', 'DPR', 'rabu', 'pukul', 'WIB', 'rapat', 'paripurna', 'DPR', 'RI', 'agendadpr']",[],[]
366,2016-11-29T22:30:56.000Z,Temui Petani Tembakau Anggota DPR Ini Janji Kawal Penyelesaian RUU Pertembakauan,temui petani tembakau anggota DPR ini janji kawal penyelesaian RUU pertembakauan,0.8,0.2,0.447213595499958,positive,"['temui', 'petani', 'tembakau', 'anggota', 'DPR', 'ini', 'janji', 'kawal', 'penyelesaian', 'RUU', 'pertembakauan']","['temui', 'petani', 'tembakau', 'anggota', 'DPR', 'kawal', 'penyelesaian', 'RUU', 'pertembakauan']",[],"['ini', 'janji']"
369,2016-11-29T13:18:38.000Z,Sangat Free hatin Ruang Rapat Paripurna DPR RI,sangat free hatin ruang rapat paripurna DPR RI,-1.6,-0.4,0.8944271909999161,negative,"['sangat', 'free', 'hatin', 'ruang', 'rapat', 'paripurna', 'DPR', 'RI']","['free', 'ruang', 'rapat', 'paripurna', 'DPR', 'RI']",['sangat'],['hatin']
401,2016-11-26T08:00:02.000Z,RUU CSR Wajib Atau Sukarela,RUU CSR wajib atau sukarela,0.2,0.05,0.447213595499958,positive,"['RUU', 'CSR', 'wajib', 'atau', 'sukarela']","['RUU', 'sukarela']",['wajib'],"['CSR', 'atau']"
411,2016-11-25T07:29:04.000Z,DPR Gali Masukan Soal RUU CSR IkiBangsaku,DPR gali masukan soal RUU CSR ikibangsaku,0.2,0.05,1.3038404810405295,positive,"['DPR', 'gali', 'masukan', 'soal', 'RUU', 'CSR', 'ikibangsaku']","['DPR', 'masukan', 'soal', 'RUU']",[],"['gali', 'CSR', 'ikibangsaku']"
420,2016-11-24T02:49:08.000Z,mohon info bagaimana kemajuan RUU_Jasa_Konstruksi?,mohon info bagaimana kemajuan ruu_jasa_konstruksi ?,-0.6,-0.15,0.8944271909999159,negative,"['mohon', 'info', 'bagaimana', 'kemajuan', 'ruu_jasa_konstruksi', '?']","['mohon', 'info', 'kemajuan']",[],"['bagaimana', 'ruu_jasa_konstruksi', '?']"
442,2016-11-22T13:48:28.000Z,Rapat Paripurna at,rapat paripurna at,0.0,0.0,0.0,neutral,"['rapat', 'paripurna', 'at']","['rapat', 'paripurna']",[],['at']
472,2016-11-19T10:49:19.000Z,Reaksi Mbah Mijan Terkait Pengesahan UU Santet lewat,reaksi mbah mijan terkait pengesahan UU santet lewat,-0.2,-0.05,0.447213595499958,negative,"['reaksi', 'mbah', 'mijan', 'terkait', 'pengesahan', 'UU', 'santet', 'lewat']","['reaksi', 'terkait', 'pengesahan', 'UU', 'santet', 'lewat']",[],"['mbah', 'mijan']"
494,2016-11-17T23:15:00.000Z,Formappi Fraksi Nasdem Paling Sering Bolos,formappi fraksi nasdem paling sering bolos,-2.2,-0.55,1.3038404810405295,negative,"['formappi', 'fraksi', 'nasdem', 'paling', 'sering', 'bolos']","['fraksi', 'nasdem', 'sering', 'bolos']",[],"['formappi', 'paling']"
523,2016-11-16T13:54:33.000Z,Pemerintah dan DPR RI sepakat menetapkan batas waktu penyelesaian pembahasan Revisi Undang undang Pemilu RUU,pemerintah dan DPR RI sepakat menetapkan batas waktu penyelesaian pembahasan revisi undang undang pemilu RUU,0.8,0.2,0.447213595499958,positive,"['pemerintah', 'dan', 'DPR', 'RI', 'sepakat', 'menetapkan', 'batas', 'waktu', 'penyelesaian', 'pembahasan', 'revisi', 'undang', 'undang', 'pemilu', 'RUU']","['pemerintah', 'DPR', 'RI', 'sepakat', 'menetapkan', 'batas', 'waktu', 'penyelesaian', 'pembahasan', 'revisi', 'undang', 'undang', 'pemilu', 'RUU']",[],['dan']
531,2016-11-16T09:27:15.000Z,DPR Komitmen Percepat Pembahasan RUU,DPR komitmen percepat pembahasan RUU,1.0,0.25,0.7071067811865476,positive,"['DPR', 'komitmen', 'percepat', 'pembahasan', 'RUU']","['DPR', 'komitmen', 'percepat', 'pembahasan', 'RUU']",[],[]
552,2016-11-15T08:34:32.000Z,Reses Wakil Rakyat Dapil Lampung I Ahmad Muzani,reses wakil rakyat dapil lampung i ahmad muzani,0.0,0.0,0.0,neutral,"['reses', 'wakil', 'rakyat', 'dapil', 'lampung', 'i', 'ahmad', 'muzani']","['reses', 'wakil', 'rakyat', 'dapil', 'i']",[],"['lampung', 'ahmad', 'muzani']"
565,2016-11-14T04:54:33.000Z,Reses anggota MS II tahun Sidang bang kumpulkan kepala desa se kabupaten Sumbawa dorong desa mandiri,reses anggota MASIH II tahun sidang bang kumpulkan kepala desa se kabupaten sumbawa dorong desa mandiri,0.8,0.2,0.447213595499958,positive,"['reses', 'anggota', 'MASIH', 'II', 'tahun', 'sidang', 'bang', 'kumpulkan', 'kepala', 'desa', 'se', 'kabupaten', 'sumbawa', 'dorong', 'desa', 'mandiri']","['reses', 'anggota', 'MASIH', 'II', 'tahun', 'sidang', 'bang', 'kepala', 'desa', 'kabupaten', 'dorong', 'desa', 'mandiri']",[],"['kumpulkan', 'se', 'sumbawa']"
566,2016-11-14T02:55:32.000Z,RESES ANGGOTA DPR RI FRAKSI PDIP MARUARAR SIRAIT,RESES ANGGOTA DPR RI FRAKSI PDIP MARUARAR SIRAIT,0.0,0.0,0.0,neutral,"['RESES', 'ANGGOTA', 'DPR', 'RI', 'FRAKSI', 'PDIP', 'MARUARAR', 'SIRAIT']","['RESES', 'ANGGOTA', 'DPR', 'RI', 'FRAKSI', 'PDIP']",[],"['MARUARAR', 'SIRAIT']"
583,2016-11-09T08:28:55.000Z,Reses DPR RI Harus Lapor ke Fraksi Golkar Daerah,reses DPR RI harus lapor ke fraksi golkar daerah,0.0,0.0,0.0,neutral,"['reses', 'DPR', 'RI', 'harus', 'lapor', 'ke', 'fraksi', 'golkar', 'daerah']","['reses', 'DPR', 'RI', 'lapor', 'fraksi', 'golkar', 'daerah']",['harus'],['ke']
606,2016-11-07T12:55:43.000Z,Kesekian kalinya Dewan Perwakilan Rakyat Daerah DPRD Kabupaten Gresik menggelar rapat paripurna penyampaian,kesekian kalinya dewan perwakilan rakyat daerah DPRD kabupaten gresik menggelar rapat paripurna penyampaian,0.0,0.0,0.0,neutral,"['kesekian', 'kalinya', 'dewan', 'perwakilan', 'rakyat', 'daerah', 'DPRD', 'kabupaten', 'gresik', 'menggelar', 'rapat', 'paripurna', 'penyampaian']","['dewan', 'perwakilan', 'rakyat', 'daerah', 'DPRD', 'kabupaten', 'menggelar', 'rapat', 'paripurna', 'penyampaian']",[],"['kesekian', 'kalinya', 'gresik']"
681,2016-10-31T18:58:51.000Z,DPR targetkan UU Perbukuan Nnasional rampung Komisi X DPR RI menargetkan rancangan Undang Undang Sis RT,DPR targetkan UU perbukuan nnasional rampung komisi kali DPR RI menargetkan rancangan undang undang sis RT,0.8,0.2,0.447213595499958,positive,"['DPR', 'targetkan', 'UU', 'perbukuan', 'nnasional', 'rampung', 'komisi', 'kali', 'DPR', 'RI', 'menargetkan', 'rancangan', 'undang', 'undang', 'sis', 'RT']","['DPR', 'targetkan', 'UU', 'perbukuan', 'rampung', 'komisi', 'DPR', 'RI', 'menargetkan', 'rancangan', 'undang', 'undang']",[],"['nnasional', 'kali', 'sis', 'RT']"
690,2016-10-31T02:44:33.000Z,Untuk menangani sampah diperlukan perspektif kebangsaan yang holistik ta hanya oleh pemangku kebijakan tap,untuk menangani sampah diperlukan perspektif kebangsaan yang holistik ta hanya oleh pemangku kebijakan tap,0.0,0.0,0.0,neutral,"['untuk', 'menangani', 'sampah', 'diperlukan', 'perspektif', 'kebangsaan', 'yang', 'holistik', 'ta', 'hanya', 'oleh', 'pemangku', 'kebijakan', 'tap']","['menangani', 'sampah', 'diperlukan', 'kebangsaan', 'ta', 'hanya', 'pemangku', 'kebijakan']","['yang', 'oleh']","['untuk', 'perspektif', 'holistik', 'tap']"
718,2016-10-29T09:00:10.000Z,Anggota DPR Indra Tersangka Penipuan Rp M MKD Bersikap Usai Reses fath,anggota DPR indra tersangka penipuan rp sama MKD bersikap usai reses fath,-1.6,-0.4,0.8944271909999161,negative,"['anggota', 'DPR', 'indra', 'tersangka', 'penipuan', 'rp', 'sama', 'MKD', 'bersikap', 'usai', 'reses', 'fath']","['anggota', 'DPR', 'tersangka', 'penipuan', 'rp', 'sama', 'MKD', 'usai', 'reses']",[],"['indra', 'bersikap', 'fath']"
745,2016-10-28T09:52:38.000Z,DPR Umumkan Susunan Anggota Pansus RUU Pemilu,DPR umumkan susunan anggota pansus RUU pemilu,0.0,0.0,0.0,neutral,"['DPR', 'umumkan', 'susunan', 'anggota', 'pansus', 'RUU', 'pemilu']","['DPR', 'umumkan', 'anggota', 'pansus', 'RUU', 'pemilu']",[],['susunan']
786,2016-10-27T11:22:50.000Z,DPR RI Sahkan Revisi RUU ITE,DPR RI sahkan revisi RUU ITE,0.4,0.1,0.5477225575051662,positive,"['DPR', 'RI', 'sahkan', 'revisi', 'RUU', 'ITE']","['DPR', 'RI', 'sahkan', 'revisi', 'RUU', 'ITE']",[],[]
790,2016-10-27T09:43:16.000Z,Paripurna DPR Sahkan RUU ITE Jadi UU,paripurna DPR sahkan RUU ITE jadi UU,0.6,0.15,0.5477225575051662,positive,"['paripurna', 'DPR', 'sahkan', 'RUU', 'ITE', 'jadi', 'UU']","['paripurna', 'DPR', 'sahkan', 'RUU', 'ITE', 'jadi', 'UU']",[],[]
825,2016-10-27T02:00:14.000Z,Anggota DPR Tak Hadir Dalam Sidang Paripurna Pengesahan UU APBN Jakarta DPR siang ini menggelar s,anggota DPR tak hadir dalam sidang paripurna pengesahan UU APBN jakarta DPR siang ini menggelar si,-2.8,-0.7,0.4472135954999578,negative,"['anggota', 'DPR', 'tak', 'hadir', 'dalam', 'sidang', 'paripurna', 'pengesahan', 'UU', 'APBN', 'jakarta', 'DPR', 'siang', 'ini', 'menggelar', 'si']","['anggota', 'DPR', 'hadir', 'dalam', 'sidang', 'paripurna', 'pengesahan', 'UU', 'APBN', 'jakarta', 'DPR', 'menggelar']",[],"['tak', 'siang', 'ini', 'si']"
829,2016-10-26T19:56:26.000Z,DPR RI Menyetujui RUU APBN,DPR RI menyetujui RUU APBN,0.2,0.05,0.447213595499958,positive,"['DPR', 'RI', 'menyetujui', 'RUU', 'APBN']","['DPR', 'RI', 'menyetujui', 'RUU', 'APBN']",[],[]
877,2016-10-26T06:20:26.000Z,Agenda hari ini Rapat Paripurna DPR Ke Masa Persidangan I Tahun Sidang agendaDPR sidangparipurna DPR RI,agenda hari ini rapat paripurna DPR ke masa persidangan i tahun sidang agendadpr sidangparipurna DPR RI,0.0,0.0,0.0,neutral,"['agenda', 'hari', 'ini', 'rapat', 'paripurna', 'DPR', 'ke', 'masa', 'persidangan', 'i', 'tahun', 'sidang', 'agendadpr', 'sidangparipurna', 'DPR', 'RI']","['agenda', 'hari', 'rapat', 'paripurna', 'DPR', 'masa', 'persidangan', 'i', 'tahun', 'sidang', 'agendadpr', 'sidangparipurna', 'DPR', 'RI']",[],"['ini', 'ke']"
879,2016-10-26T05:26:12.000Z,Syarifuddin Suding RUU Pemilu Akan Digiring ke Pemilu Sistem Proporsional Tertutup,syarifuddin suding RUU pemilu akan digiring ke pemilu sistem proporsional tertutup,0.0,0.0,0.0,neutral,"['syarifuddin', 'suding', 'RUU', 'pemilu', 'akan', 'digiring', 'ke', 'pemilu', 'sistem', 'proporsional', 'tertutup']","['RUU', 'pemilu', 'pemilu', 'sistem', 'tertutup']",[],"['syarifuddin', 'suding', 'akan', 'digiring', 'ke', 'proporsional']"
1003,2016-10-20T10:03:32.000Z,Wakil Ketua DPR RI Agus Hermanto mendorong pemerintah segera menyerahkan draf Rancangan Undang Undang RUU P,wakil ketua DPR RI agus hermanto mendorong pemerintah segera menyerahkan draf rancangan undang undang RUU p,0.8,0.2,0.447213595499958,positive,"['wakil', 'ketua', 'DPR', 'RI', 'agus', 'hermanto', 'mendorong', 'pemerintah', 'segera', 'menyerahkan', 'draf', 'rancangan', 'undang', 'undang', 'RUU', 'p']","['wakil', 'ketua', 'DPR', 'RI', 'mendorong', 'pemerintah', 'segera', 'menyerahkan', 'draf', 'rancangan', 'undang', 'undang', 'RUU']",[],"['agus', 'hermanto', 'p']"
1032,2016-10-19T16:29:23.000Z,Usai Reses Ruhut Mundur sebagai Anggota DPR RI,usai reses ruhut mundur sebagai anggota DPR RI,-0.2,-0.05,0.447213595499958,negative,"['usai', 'reses', 'ruhut', 'mundur', 'sebagai', 'anggota', 'DPR', 'RI']","['usai', 'reses', 'mundur', 'sebagai', 'anggota', 'DPR', 'RI']",[],['ruhut']
1033,2016-10-19T15:20:37.000Z,Terimakasih Indonesia Sahkan Paris Agreement Jadi Undang Undang,terimakasih indonesia sahkan paris agreement jadi undang undang,1.4,0.35,0.5477225575051661,positive,"['terimakasih', 'indonesia', 'sahkan', 'paris', 'agreement', 'jadi', 'undang', 'undang']","['terimakasih', 'indonesia', 'sahkan', 'jadi', 'undang', 'undang']",[],"['paris', 'agreement']"
1121,2016-10-14T09:16:22.000Z,Panja RUU Sistem Perbukuan Identifikasi Masalah Utama,panja RUU sistem perbukuan identifikasi masalah utama,0.2,0.05,0.447213595499958,positive,"['panja', 'RUU', 'sistem', 'perbukuan', 'identifikasi', 'masalah', 'utama']","['panja', 'RUU', 'sistem', 'perbukuan', 'identifikasi', 'masalah']",[],['utama']
1155,2016-10-13T01:49:36.000Z,DPR Sahkan UU Pelaksanaan Hukuman Kebiri JAKARTA SK Pihak DPR RI akhirnya mengesahkan undang undang UU,DPR sahkan UU pelaksanaan hukuman kebiri JAKARTA SUKA pihak DPR RI akhirnya mengesahkan undang undang UU,0.4,0.1,0.5477225575051662,positive,"['DPR', 'sahkan', 'UU', 'pelaksanaan', 'hukuman', 'kebiri', 'JAKARTA', 'SUKA', 'pihak', 'DPR', 'RI', 'akhirnya', 'mengesahkan', 'undang', 'undang', 'UU']","['DPR', 'sahkan', 'UU', 'pelaksanaan', 'hukuman', 'kebiri', 'JAKARTA', 'SUKA', 'pihak', 'DPR', 'RI', 'mengesahkan', 'undang', 'undang', 'UU']",[],['akhirnya']
1223,2016-10-12T02:40:42.000Z,DPR Kembali Bahas UU Perppu di Rapat Paripurna Dewan Perwakilan Rakyat DPR,DPR kembali bahas UU perppu di rapat paripurna dewan perwakilan rakyat DPR,0.0,0.0,0.0,neutral,"['DPR', 'kembali', 'bahas', 'UU', 'perppu', 'di', 'rapat', 'paripurna', 'dewan', 'perwakilan', 'rakyat', 'DPR']","['DPR', 'bahas', 'UU', 'perppu', 'rapat', 'paripurna', 'dewan', 'perwakilan', 'rakyat', 'DPR']",[],"['kembali', 'di']"
1232,2016-10-11T09:38:26.000Z,Rapat juga menyetujui perpanjangan waktu pembahasan Pansus RUU PPILN sampai dengan Masa Persidangan II Tahun Sidang,rapat juga menyetujui perpanjangan waktu pembahasan pansus RUU PPILN sampai dengan masa persidangan II tahun sidang,-0.4,-0.1,0.5477225575051662,negative,"['rapat', 'juga', 'menyetujui', 'perpanjangan', 'waktu', 'pembahasan', 'pansus', 'RUU', 'PPILN', 'sampai', 'dengan', 'masa', 'persidangan', 'II', 'tahun', 'sidang']","['rapat', 'menyetujui', 'perpanjangan', 'waktu', 'pembahasan', 'pansus', 'RUU', 'sampai', 'masa', 'persidangan', 'II', 'tahun', 'sidang']",[],"['juga', 'PPILN', 'dengan']"
1260,2016-10-10T13:03:13.000Z,KabaKampuang Fraksi Partai Kebangkitan Bangsa di DPR RI akan mengusulkan RUU Pendidikan Madrasah dan Pondok Pesan,kabakampuang fraksi partai kebangkitan bangsa di DPR RI akan mengusulkan RUU pendidikan madrasah dan pondok pesan,0.8,0.2,0.447213595499958,positive,"['kabakampuang', 'fraksi', 'partai', 'kebangkitan', 'bangsa', 'di', 'DPR', 'RI', 'akan', 'mengusulkan', 'RUU', 'pendidikan', 'madrasah', 'dan', 'pondok', 'pesan']","['fraksi', 'partai', 'kebangkitan', 'DPR', 'RI', 'mengusulkan', 'RUU', 'pendidikan', 'pesan']",[],"['kabakampuang', 'bangsa', 'di', 'akan', 'madrasah', 'dan', 'pondok']"
1279,2016-10-09T23:07:21.000Z,Dewan Perwakilan Rakyat DPR meminta aturan turunan dari Undang Undang UU No Tahun tentang Pendidikan,dewan perwakilan rakyat DPR meminta aturan turunan dari undang undang UU no tahun tentang pendidikan,0.2,0.05,0.447213595499958,positive,"['dewan', 'perwakilan', 'rakyat', 'DPR', 'meminta', 'aturan', 'turunan', 'dari', 'undang', 'undang', 'UU', 'no', 'tahun', 'tentang', 'pendidikan']","['dewan', 'perwakilan', 'rakyat', 'DPR', 'meminta', 'aturan', 'turunan', 'undang', 'undang', 'UU', 'tahun', 'tentang', 'pendidikan']",['dari'],['no']
1282,2016-10-08T20:03:18.000Z,DPR bebas visa disalahgunakan jatim rugi Rp triliun Komisi III DPR RI menemukan penyalahgunaan kebijakan bebas,DPR bebas visa disalahgunakan jatim rugi rp triliun komisi II DPR RI menemukan penyalahgunaan kebijakan bebas,-1.4,-0.35,0.8944271909999159,negative,"['DPR', 'bebas', 'visa', 'disalahgunakan', 'jatim', 'rugi', 'rp', 'triliun', 'komisi', 'II', 'DPR', 'RI', 'menemukan', 'penyalahgunaan', 'kebijakan', 'bebas']","['DPR', 'bebas', 'visa', 'disalahgunakan', 'rugi', 'rp', 'triliun', 'komisi', 'II', 'DPR', 'RI', 'menemukan', 'penyalahgunaan', 'kebijakan', 'bebas']",[],['jatim']
1290,2016-10-07T00:54:12.000Z,Anggota DPR Apresiasi Penghentian Kebijakan Plastik Berbayar,anggota DPR apresiasi penghentian kebijakan plastik berbayar,0.8,0.2,0.447213595499958,positive,"['anggota', 'DPR', 'apresiasi', 'penghentian', 'kebijakan', 'plastik', 'berbayar']","['anggota', 'DPR', 'apresiasi', 'kebijakan', 'berbayar']",[],"['penghentian', 'plastik']"
1327,2016-10-05T17:45:55.000Z,DPR dukung undang undang khusus tentang Antara Anggota Komisi I DPR RI yang juga pernah menjadi pemimpin reda,DPR dukung undang undang khusus tentang antara anggota komisi i DPR RI yang juga pernah menjadi pemimpin reda,0.8,0.2,0.447213595499958,positive,"['DPR', 'dukung', 'undang', 'undang', 'khusus', 'tentang', 'antara', 'anggota', 'komisi', 'i', 'DPR', 'RI', 'yang', 'juga', 'pernah', 'menjadi', 'pemimpin', 'reda']","['DPR', 'dukung', 'undang', 'undang', 'tentang', 'anggota', 'komisi', 'i', 'DPR', 'RI', 'pemimpin']",['yang'],"['khusus', 'antara', 'juga', 'pernah', 'menjadi', 'reda']"
1406,2016-09-28T05:14:03.000Z,Komisi II DPR RI Siap Bahas Pasal RUU Pemilu,komisi II DPR RI siap bahas pasal RUU pemilu,0.2,0.05,0.447213595499958,positive,"['komisi', 'II', 'DPR', 'RI', 'siap', 'bahas', 'pasal', 'RUU', 'pemilu']","['komisi', 'II', 'DPR', 'RI', 'siap', 'bahas', 'pasal', 'RUU', 'pemilu']",[],[]
1412,2016-09-27T23:57:38.000Z,hukumOnline Jika RUU Jabatan Hakim Disahkan Hakim Bukan Monopoli MA Dewan Perwakilan Rakyat DPR menjad,hukumonline jika RUU jabatan hakim disahkan hakim bukan monopoli SAMA dewan perwakilan rakyat DPR menjad,0.0,0.0,0.0,neutral,"['hukumonline', 'jika', 'RUU', 'jabatan', 'hakim', 'disahkan', 'hakim', 'bukan', 'monopoli', 'SAMA', 'dewan', 'perwakilan', 'rakyat', 'DPR', 'menjad']","['RUU', 'jabatan', 'hakim', 'disahkan', 'hakim', 'monopoli', 'SAMA', 'dewan', 'perwakilan', 'rakyat', 'DPR']",['bukan'],"['hukumonline', 'jika', 'menjad']"
1449,2016-09-22T07:22:19.000Z,Tribun Rieke Diah Pitaloka Undang Undang Tax Amnesty Jangan Menakuti Pengusaha NewsToday DKK,tribun rieke diah pitaloka undang undang tax amnesty jangan menakuti pengusaha newstoday DKK,0.0,0.0,0.0,neutral,"['tribun', 'rieke', 'diah', 'pitaloka', 'undang', 'undang', 'tax', 'amnesty', 'jangan', 'menakuti', 'pengusaha', 'newstoday', 'DKK']","['tribun', 'undang', 'undang', 'tax', 'amnesty', 'menakuti', 'pengusaha']",['jangan'],"['rieke', 'diah', 'pitaloka', 'newstoday', 'DKK']"
1482,2016-09-20T07:07:10.000Z,Cari Masukan RUU Karantina Hewan Ikan dan Tumbuhan Komisi IV DPR RI Gelar FGD di Undip,cari masukan RUU karantina hewan ikan dan tumbuhan komisi IV DPR RI gelar FGD di undip,0.8,0.2,0.447213595499958,positive,"['cari', 'masukan', 'RUU', 'karantina', 'hewan', 'ikan', 'dan', 'tumbuhan', 'komisi', 'IV', 'DPR', 'RI', 'gelar', 'FGD', 'di', 'undip']","['cari', 'masukan', 'RUU', 'karantina', 'komisi', 'IV', 'DPR', 'RI', 'gelar', 'FGD']",[],"['hewan', 'ikan', 'dan', 'tumbuhan', 'di', 'undip']"
1514,2016-09-15T08:20:44.000Z,Berlanjut Baleg DPR RI Bahas DIM RUU Kekarantinaan Kesehatan,berlanjut baleg DPR RI bahas DIM RUU kekarantinaan kesehatan,0.0,0.0,0.0,neutral,"['berlanjut', 'baleg', 'DPR', 'RI', 'bahas', 'DIM', 'RUU', 'kekarantinaan', 'kesehatan']","['berlanjut', 'baleg', 'DPR', 'RI', 'bahas', 'RUU', 'kesehatan']",[],"['DIM', 'kekarantinaan']"
1567,2016-09-10T12:33:07.000Z,Anggota DPR RUU ITE mengacu putusan MK Indonesia,anggota DPR RUU ITE mengacu putusan MAKA indonesia,0.0,0.0,0.0,neutral,"['anggota', 'DPR', 'RUU', 'ITE', 'mengacu', 'putusan', 'MAKA', 'indonesia']","['anggota', 'DPR', 'RUU', 'ITE', 'putusan', 'indonesia']",[],"['mengacu', 'MAKA']"
1569,2016-09-10T12:32:44.000Z,Anggota DPR RUU ITE mengacu putusan MK politik,anggota DPR RUU ITE mengacu putusan MAKA politik,-0.4,-0.1,0.5477225575051662,negative,"['anggota', 'DPR', 'RUU', 'ITE', 'mengacu', 'putusan', 'MAKA', 'politik']","['anggota', 'DPR', 'RUU', 'ITE', 'putusan', 'politik']",[],"['mengacu', 'MAKA']"
1587,2016-09-09T00:15:54.000Z,Hari Hari Sepi Rapat Paripurna DPR Berlanjut,hari hari sepi rapat paripurna DPR berlanjut,-2.0,-0.5,0.0,negative,"['hari', 'hari', 'sepi', 'rapat', 'paripurna', 'DPR', 'berlanjut']","['hari', 'hari', 'sepi', 'rapat', 'paripurna', 'DPR', 'berlanjut']",[],[]
1759,2016-08-28T11:02:53.000Z,Baleg DPR RI Undang PP IPPAT Bahas Persiapan Pengesahan RUU PPAT,baleg DPR RI undang PP IPPAT bahas persiapan pengesahan RUU PPAT,0.8,0.2,0.4472135954999579,positive,"['baleg', 'DPR', 'RI', 'undang', 'PP', 'IPPAT', 'bahas', 'persiapan', 'pengesahan', 'RUU', 'PPAT']","['baleg', 'DPR', 'RI', 'undang', 'PP', 'bahas', 'persiapan', 'pengesahan', 'RUU']",[],"['IPPAT', 'PPAT']"
1765,2016-08-27T13:44:06.000Z,Menyambut HUTDPR pada Agustus juga akan diadakan Rapat Paripurna DPR RI dengan agenda tunggal laporan kinerja DPR RI HUTDPR,menyambut HUTDPR pada agustus juga akan diadakan rapat paripurna DPR RI dengan agenda tunggal laporan kinerja DPR RI HUTDPR,0.6,0.15,0.5477225575051662,positive,"['menyambut', 'HUTDPR', 'pada', 'agustus', 'juga', 'akan', 'diadakan', 'rapat', 'paripurna', 'DPR', 'RI', 'dengan', 'agenda', 'tunggal', 'laporan', 'kinerja', 'DPR', 'RI', 'HUTDPR']","['menyambut', 'HUTDPR', 'agustus', 'diadakan', 'rapat', 'paripurna', 'DPR', 'RI', 'agenda', 'laporan', 'kinerja', 'DPR', 'RI', 'HUTDPR']",['pada'],"['juga', 'akan', 'dengan', 'tunggal']"
